{
  "version": "0.1.0",
  "git_hash": null,
  "timestamp": "2026-02-20T04:44:30Z",
  "platform": {
    "os": "macos",
    "arch": "aarch64",
    "rust_version": "unknown"
  },
  "config": {
    "target": 3.14159,
    "level": 2.0,
    "max_lhs_complexity": 18,
    "max_rhs_complexity": 20,
    "deterministic": false,
    "parallel": true,
    "max_error": 0.0314159,
    "max_matches": 80,
    "ranking_mode": "complexity",
    "user_constants": [],
    "excluded_symbols": [],
    "allowed_symbols": null
  },
  "results": [
    {
      "lhs_postfix": "8xv",
      "rhs_postfix": "8pv",
      "lhs_infix": "8\"/x",
      "rhs_infix": "8\"/pi",
      "error": 2.653589790124755e-6,
      "is_exact": false,
      "complexity": 38,
      "x_value": 3.14159265358979,
      "stability": 0.7323808390759148
    },
    {
      "lhs_postfix": "5x+",
      "rhs_postfix": "5p+",
      "lhs_infix": "5+x",
      "rhs_infix": "5+pi",
      "error": 2.653589792345201e-6,
      "is_exact": false,
      "complexity": 30,
      "x_value": 3.1415926535897922,
      "stability": 1.0
    },
    {
      "lhs_postfix": "6x+",
      "rhs_postfix": "6p+",
      "lhs_infix": "6+x",
      "rhs_infix": "6+pi",
      "error": 2.653589792345201e-6,
      "is_exact": false,
      "complexity": 30,
      "x_value": 3.1415926535897922,
      "stability": 1.0
    },
    {
      "lhs_postfix": "7x+",
      "rhs_postfix": "7p+",
      "lhs_infix": "7+x",
      "rhs_infix": "7+pi",
      "error": 2.653589792345201e-6,
      "is_exact": false,
      "complexity": 32,
      "x_value": 3.1415926535897922,
      "stability": 1.0
    },
    {
      "lhs_postfix": "8x+",
      "rhs_postfix": "8p+",
      "lhs_infix": "8+x",
      "rhs_infix": "8+pi",
      "error": 2.653589792345201e-6,
      "is_exact": false,
      "complexity": 32,
      "x_value": 3.1415926535897922,
      "stability": 1.0
    },
    {
      "lhs_postfix": "9x+",
      "rhs_postfix": "9p+",
      "lhs_infix": "9+x",
      "rhs_infix": "9+pi",
      "error": 2.653589792345201e-6,
      "is_exact": false,
      "complexity": 32,
      "x_value": 3.1415926535897922,
      "stability": 1.0
    },
    {
      "lhs_postfix": "x2A",
      "rhs_postfix": "p2A",
      "lhs_infix": "atan2(x, 2)",
      "rhs_infix": "atan2(pi, 2)",
      "error": 2.653589792345201e-6,
      "is_exact": false,
      "complexity": 34,
      "x_value": 3.1415926535897922,
      "stability": 0.831793288750472
    },
    {
      "lhs_postfix": "ex+",
      "rhs_postfix": "ep+",
      "lhs_infix": "e+x",
      "rhs_infix": "e+pi",
      "error": 2.653589792345201e-6,
      "is_exact": false,
      "complexity": 36,
      "x_value": 3.1415926535897922,
      "stability": 1.0
    },
    {
      "lhs_postfix": "4sx+",
      "rhs_postfix": "4sp+",
      "lhs_infix": "4^2+x",
      "rhs_infix": "4^2+pi",
      "error": 2.653589792345201e-6,
      "is_exact": false,
      "complexity": 38,
      "x_value": 3.1415926535897922,
      "stability": 1.0
    },
    {
      "lhs_postfix": "4sx-",
      "rhs_postfix": "4sp-",
      "lhs_infix": "4^2-x",
      "rhs_infix": "4^2-pi",
      "error": 2.653589792345201e-6,
      "is_exact": false,
      "complexity": 38,
      "x_value": 3.1415926535897922,
      "stability": 1.0
    },
    {
      "lhs_postfix": "5x+n",
      "rhs_postfix": "5p+n",
      "lhs_infix": "-(5+x)",
      "rhs_infix": "-(5+pi)",
      "error": 2.653589792345201e-6,
      "is_exact": false,
      "complexity": 38,
      "x_value": 3.1415926535897922,
      "stability": 1.0
    },
    {
      "lhs_postfix": "6x+n",
      "rhs_postfix": "6p+n",
      "lhs_infix": "-(6+x)",
      "rhs_infix": "-(6+pi)",
      "error": 2.653589792345201e-6,
      "is_exact": false,
      "complexity": 38,
      "x_value": 3.1415926535897922,
      "stability": 1.0
    },
    {
      "lhs_postfix": "7xv",
      "rhs_postfix": "7pv",
      "lhs_infix": "7\"/x",
      "rhs_infix": "7\"/pi",
      "error": 2.653589792345201e-6,
      "is_exact": false,
      "complexity": 38,
      "x_value": 3.1415926535897922,
      "stability": 0.7457547624209561
    },
    {
      "lhs_postfix": "x4s-",
      "rhs_postfix": "p4s-",
      "lhs_infix": "x-4^2",
      "rhs_infix": "pi-4^2",
      "error": 2.653589792345201e-6,
      "is_exact": false,
      "complexity": 38,
      "x_value": 3.1415926535897922,
      "stability": 1.0
    },
    {
      "lhs_postfix": "xq",
      "rhs_postfix": "pq",
      "lhs_infix": "sqrt(x)",
      "rhs_infix": "sqrt(pi)",
      "error": 2.6535897927892904e-6,
      "is_exact": false,
      "complexity": 26,
      "x_value": 3.1415926535897927,
      "stability": 0.8900790502810915
    },
    {
      "lhs_postfix": "3xv",
      "rhs_postfix": "3pv",
      "lhs_infix": "3\"/x",
      "rhs_infix": "3\"/pi",
      "error": 2.6535897927892904e-6,
      "is_exact": false,
      "complexity": 34,
      "x_value": 3.1415926535897927,
      "stability": 0.8382891482745845
    },
    {
      "lhs_postfix": "xqn",
      "rhs_postfix": "pqn",
      "lhs_infix": "-sqrt(x)",
      "rhs_infix": "-sqrt(pi)",
      "error": 2.6535897927892904e-6,
      "is_exact": false,
      "complexity": 34,
      "x_value": 3.1415926535897927,
      "stability": 0.8900790502810915
    },
    {
      "lhs_postfix": "1x+r",
      "rhs_postfix": "1p+r",
      "lhs_infix": "1/(1+x)",
      "rhs_infix": "1/(1+pi)",
      "error": 2.6535897927892904e-6,
      "is_exact": false,
      "complexity": 36,
      "x_value": 3.1415926535897927,
      "stability": 0.7531331586570769
    },
    {
      "lhs_postfix": "1xr+",
      "rhs_postfix": "1pr+",
      "lhs_infix": "1+1/x",
      "rhs_infix": "1+1/pi",
      "error": 2.6535897927892904e-6,
      "is_exact": false,
      "complexity": 36,
      "x_value": 3.1415926535897927,
      "stability": 0.8011401976555507
    },
    {
      "lhs_postfix": "1xr-",
      "rhs_postfix": "1pr-",
      "lhs_infix": "1-1/x",
      "rhs_infix": "1-1/pi",
      "error": 2.6535897927892904e-6,
      "is_exact": false,
      "complexity": 36,
      "x_value": 3.1415926535897927,
      "stability": 0.8011401976555507
    },
    {
      "lhs_postfix": "2x+r",
      "rhs_postfix": "2p+r",
      "lhs_infix": "1/(2+x)",
      "rhs_infix": "1/(2+pi)",
      "error": 2.6535897927892904e-6,
      "is_exact": false,
      "complexity": 36,
      "x_value": 3.1415926535897927,
      "stability": 0.7155610231065779
    },
    {
      "lhs_postfix": "2xr-",
      "rhs_postfix": "2pr-",
      "lhs_infix": "2-1/x",
      "rhs_infix": "2-1/pi",
      "error": 2.6535897927892904e-6,
      "is_exact": false,
      "complexity": 36,
      "x_value": 3.1415926535897927,
      "stability": 0.8011401976555507
    },
    {
      "lhs_postfix": "x5v",
      "rhs_postfix": "p5v",
      "lhs_infix": "x\"/5",
      "rhs_infix": "pi\"/5",
      "error": 2.6535897927892904e-6,
      "is_exact": false,
      "complexity": 36,
      "x_value": 3.1415926535897927,
      "stability": 0.8869728932447168
    },
    {
      "lhs_postfix": "xr1-",
      "rhs_postfix": "pr1-",
      "lhs_infix": "1/x-1",
      "rhs_infix": "1/pi-1",
      "error": 2.6535897927892904e-6,
      "is_exact": false,
      "complexity": 36,
      "x_value": 3.1415926535897927,
      "stability": 0.8011401976555507
    },
    {
      "lhs_postfix": "xr2-",
      "rhs_postfix": "pr2-",
      "lhs_infix": "1/x-2",
      "rhs_infix": "1/pi-2",
      "error": 2.6535897927892904e-6,
      "is_exact": false,
      "complexity": 36,
      "x_value": 3.1415926535897927,
      "stability": 0.8011401976555507
    },
    {
      "lhs_postfix": "1x+q",
      "rhs_postfix": "1p+q",
      "lhs_infix": "sqrt(1+x)",
      "rhs_infix": "sqrt(1+pi)",
      "error": 2.6535897927892904e-6,
      "is_exact": false,
      "complexity": 38,
      "x_value": 3.1415926535897927,
      "stability": 0.878077290531473
    },
    {
      "lhs_postfix": "1xq-",
      "rhs_postfix": "1pq-",
      "lhs_infix": "1-sqrt(x)",
      "rhs_infix": "1-sqrt(pi)",
      "error": 2.6535897927892904e-6,
      "is_exact": false,
      "complexity": 38,
      "x_value": 3.1415926535897927,
      "stability": 0.8900790502810915
    },
    {
      "lhs_postfix": "2qx*",
      "rhs_postfix": "2qp*",
      "lhs_infix": "sqrt(2)*x",
      "rhs_infix": "sqrt(2)*pi",
      "error": 2.6535897927892904e-6,
      "is_exact": false,
      "complexity": 38,
      "x_value": 3.1415926535897927,
      "stability": 0.9698970004336018
    },
    {
      "lhs_postfix": "2x*q",
      "rhs_postfix": "2p*q",
      "lhs_infix": "sqrt(2 x)",
      "rhs_infix": "sqrt(2 pi)",
      "error": 2.6535897927892904e-6,
      "is_exact": false,
      "complexity": 38,
      "x_value": 3.1415926535897927,
      "stability": 0.9201820498474895
    },
    {
      "lhs_postfix": "2xq*",
      "rhs_postfix": "2pq*",
      "lhs_infix": "2 sqrt(x)",
      "rhs_infix": "2 sqrt(pi)",
      "error": 2.6535897927892904e-6,
      "is_exact": false,
      "complexity": 38,
      "x_value": 3.1415926535897927,
      "stability": 0.9502850494138877
    },
    {
      "lhs_postfix": "2xq-",
      "rhs_postfix": "2pq-",
      "lhs_infix": "2-sqrt(x)",
      "rhs_infix": "2-sqrt(pi)",
      "error": 2.6535897927892904e-6,
      "is_exact": false,
      "complexity": 38,
      "x_value": 3.1415926535897927,
      "stability": 0.8900790502810915
    },
    {
      "lhs_postfix": "3x+s",
      "rhs_postfix": "3p+s",
      "lhs_infix": "(3+x)^2",
      "rhs_infix": "(3+pi)^2",
      "error": 2.6535897927892904e-6,
      "is_exact": false,
      "complexity": 38,
      "x_value": 3.1415926535897927,
      "stability": 0.7821378367747073
    },
    {
      "lhs_postfix": "6xA",
      "rhs_postfix": "6pA",
      "lhs_infix": "atan2(6, x)",
      "rhs_infix": "atan2(6, pi)",
      "error": 2.6535897927892904e-6,
      "is_exact": false,
      "complexity": 38,
      "x_value": 3.1415926535897927,
      "stability": 0.8233252827270963
    },
    {
      "lhs_postfix": "xq1-",